[
  {
    "id": "mail-126.page-operate",
    "featureIds": [
      "mail-compose"
    ],
    "description": "在 126 邮箱写信页上可见地代用户操作（点击/填写/读取），用户能全程看到每一步高亮与执行。当用户要求在页面上撰写邮件（填收件人/主题/正文）或让其看到操作过程时使用；只能操作当前页面已有元素——使用前必须先调用 page_snapshot 获取可交互元素清单，steps 中每个 ref 都必须取自最近一次快照（含 iframe 内正文编辑器的带 frame 路径 ref）；需要向用户回报的页面值用 read 步骤（带 name 键）采集。收件人多人时以分号隔开。发送为独立不可撤回动作、不在本工具范围。 调用约定：先在文本中向用户说明将进行的功能级步骤；task 在整个任务期间保持不变（首批触发一次用户授权，其后同任务批次自动放行）；每批执行后必须重新调用 page_snapshot 复核，以页面证据（而非执行结果 ok）判定业务成败。",
    "params": {
      "type": "object",
      "additionalProperties": false,
      "required": [
        "task",
        "steps",
        "summary"
      ],
      "properties": {
        "task": {
          "type": "string",
          "description": "任务标题（功能级，如\"撰写邮件给 231889617@qq.com\"）。同一任务的所有批次保持同一标题——用户按它授权一次后，本任务后续批次自动执行"
        },
        "steps": {
          "type": "array",
          "minItems": 1,
          "maxItems": 20,
          "items": {
            "type": "object"
          },
          "description": "按序执行的操作步骤：{action: click|fill|select|read|scroll|highlight, ref, value?, name?}"
        },
        "summary": {
          "type": "string",
          "description": "面向用户的操作摘要，将展示在确认卡上"
        }
      }
    },
    "execution": "client",
    "riskTier": "hitl",
    "adapter": {
      "kind": "dom",
      "pathPrefixes": [
        "/"
      ]
    },
    "resultSchema": {
      "type": "object",
      "required": [
        "reads",
        "completedSteps"
      ],
      "properties": {
        "reads": {
          "type": "object"
        },
        "completedSteps": {
          "type": "number"
        }
      }
    }
  }
]
