[
  {
    "id": "browse.page-operate",
    "featureIds": ["browse"],
    "description": "在当前页面上可见地代用户操作：点击、填写、选择、读取与滚动，用户全程可见每一步高亮。本站点无专属配置，只能操作当前页面已有元素——使用前必须先 page_snapshot，steps 中每个 ref 取自最近一次快照；需要回报的页面信息用 read 步骤（带 name 键）采集。每一批操作都会请用户单独确认；涉及发送消息、支付、删除等不可撤回动作时，必须在 summary 中显著声明并建议用户核对后再批准。task 在同一任务期间保持同一标题；任务首批附 plan（目标/步骤范围/上限），展示在确认卡上；每批后重新 page_snapshot 复核。",
    "params": {
      "type": "object",
      "additionalProperties": false,
      "required": ["task", "steps", "summary"],
      "properties": {
        "task": { "type": "string", "description": "任务标题，同一任务期间保持不变" },
        "plan": { "type": "array", "items": { "type": "string" }, "description": "任务级执行计划（目标/步骤范围/上限）。任务首批必附，展示在确认卡上；后续批次可省略" },
        "steps": { "type": "array", "minItems": 1, "maxItems": 20, "items": { "type": "object" }, "description": "按序执行的操作步骤：{action: click|fill|select|read|scroll|highlight, ref, value?, name?}——read 步骤带 name 采集页面文本；不可撤回动作须已在 summary 声明" },
        "summary": { "type": "string", "description": "面向用户的操作摘要，将展示在确认卡上；含不可撤回动作时须显著声明" }
      }
    },
    "execution": "client",
    "riskTier": "hitl",
    "hitlMode": "every-call",
    "adapter": { "kind": "dom", "pathPrefixes": ["/"] },
    "resultSchema": {
      "type": "object",
      "properties": { "reads": { "type": "object" }, "completedSteps": { "type": "number" }, "url": { "type": "string" } }
    }
  }
]
