[
  {
    "id": "g6-explain.page-operate",
    "featureIds": ["billing-guide"],
    "description": "在账单页可见地点击、筛选或读取页面值。使用前必须 page_snapshot，steps 中每个 ref 取自最近快照。",
    "params": {
      "type": "object",
      "additionalProperties": false,
      "required": ["task", "steps", "summary"],
      "properties": {
        "task": { "type": "string", "description": "任务标题，同一任务期间保持不变" },
        "steps": {
          "type": "array",
          "minItems": 1,
          "maxItems": 8,
          "items": { "type": "object" },
          "description": "操作步骤：click|select|read|scroll|highlight；ref 必须来自最近快照"
        },
        "summary": { "type": "string", "description": "展示给用户的本批操作摘要" }
      }
    },
    "execution": "client",
    "riskTier": "hitl",
    "adapter": { "kind": "dom", "pathPrefixes": ["/console"] },
    "resultSchema": {
      "type": "object",
      "properties": {
        "reads": { "type": "object" },
        "completedSteps": { "type": "number" },
        "url": { "type": "string" }
      }
    }
  }
]
