[
  {
    "id": "job-search.page-operate",
    "featureIds": ["job-search"],
    "description": "在 BOSS直聘职位搜索/列表页可见地代用户操作：填写搜索关键词、选择城市/经验/薪资等筛选项、读取并回报职位卡片。用户全程可见每一步高亮。只能操作当前页面已有元素——使用前必须先 page_snapshot，steps 中每个 ref 取自最近一次快照；需回报的职位信息用 read 步骤（带 name 键）采集。MUST NOT 点击\"立即沟通/投递\"按钮——打招呼走 job-search.greet。task 在整个求职任务期间保持同一标题；任务首批附 plan（含匹配标准/自动范围/上限），展示在授权卡上供用户知情批准；每批后重新 page_snapshot 复核。",
    "params": {
      "type": "object",
      "additionalProperties": false,
      "required": ["task", "steps", "summary"],
      "properties": {
        "task": { "type": "string", "description": "任务标题（功能级），与本求职任务其它功能页保持同一标题，不另起" },
        "plan": { "type": "array", "items": { "type": "string" }, "description": "本任务的功能级执行计划（含匹配标准/自动范围/上限）。任务首批必附，展示在授权卡上；后续批次可省略" },
        "steps": { "type": "array", "minItems": 1, "maxItems": 20, "items": { "type": "object" }, "description": "按序执行的操作步骤：{action: click|fill|select|read|scroll|highlight, ref, value?, name?}——read 步骤带 name 采集卡片文本；不得点\"立即沟通/投递\"（走 greet）" },
        "summary": { "type": "string", "description": "面向用户的操作摘要，将展示在确认卡上" }
      }
    },
    "execution": "client",
    "riskTier": "hitl",
    "adapter": { "kind": "dom", "pathPrefixes": ["/web/geek/job"] },
    "resultSchema": {
      "type": "object",
      "properties": { "reads": { "type": "object" }, "completedSteps": { "type": "number" }, "url": { "type": "string" } }
    }
  },
  {
    "id": "job-search.greet",
    "featureIds": ["job-search"],
    "description": "在职位列表页对某个达标职位点\"立即沟通\"按钮打招呼（系统自动发默认招呼语，对外不可撤回动作）。仅对满足匹配门槛的职位调用（判定见功能规则）；列表卡片信息不足以确认硬性能力要求时 MUST NOT 仅凭列表打招呼，先进详情页判定或跳过。逐家单独调用、MUST NOT 群发；per-task 授权，用户首批授权本求职任务后同任务自动放行。使用前先 page_snapshot 取该职位\"立即沟通\"按钮 ref；steps 只含一次对该按钮的 click。company/position/matchReason/strengths 为留痕字段，随审计事件流留存供事后查看。达用户设定的数量上限即停止调用。",
    "params": {
      "type": "object",
      "additionalProperties": false,
      "required": ["task", "summary", "company", "position", "matchReason", "steps"],
      "properties": {
        "task": { "type": "string", "description": "任务标题（功能级），与本求职任务其它功能页保持同一标题，不另起" },
        "summary": { "type": "string", "description": "面向用户的操作摘要（如\"向 XX 公司 后端工程师 岗打招呼\"）" },
        "company": { "type": "string", "description": "留痕：目标企业名" },
        "position": { "type": "string", "description": "留痕：目标职位名" },
        "matchReason": { "type": "string", "description": "留痕：为什么向这家打招呼——行业/经验/地点/能力如何匹配画像的判断依据" },
        "strengths": { "type": "string", "description": "留痕：用户相对该职位的核心优势（可选）" },
        "steps": { "type": "array", "minItems": 1, "maxItems": 3, "items": { "type": "object" }, "description": "只含一次对该职位\"立即沟通\"按钮的 click：{action: click, ref}" }
      }
    },
    "execution": "client",
    "riskTier": "hitl",
    "hitlMode": "per-task",
    "adapter": { "kind": "dom", "pathPrefixes": ["/web/geek/job"] },
    "resultSchema": {
      "type": "object",
      "properties": { "completedSteps": { "type": "number" }, "url": { "type": "string" } }
    }
  }
]
