[
  {
    "id": "xianyu-orders.page-operate",
    "featureIds": ["xianyu-orders"],
    "description": "在闲鱼订单管理或订单详情页可见地筛选、读取、滚动、打开详情或联系入口。使用前必须 page_snapshot，steps 的 ref 取自最近快照；读取订单时用 read 步骤分别采集平台状态、订单编号和目标入口，并确认它们属于同一订单块。进入新标签页或 hash 路由后必须重新快照；本工具不得填写或发送消息，不得点击发货、退款、提醒收货、延长收货或批量操作。",
    "params": {
      "type": "object",
      "additionalProperties": false,
      "required": ["task", "steps", "summary"],
      "properties": {
        "task": { "type": "string", "description": "订单任务标题，同一订单任务保持不变" },
        "plan": { "type": "array", "items": { "type": "string" }, "description": "首批操作计划，包含观察、判断和复核" },
        "steps": { "type": "array", "minItems": 1, "maxItems": 8, "items": { "type": "object" }, "description": "操作步骤：click|select|read|scroll|highlight；不得包含 fill 或副作用按钮点击" },
        "summary": { "type": "string", "description": "展示给用户的本批操作摘要" }
      }
    },
    "execution": "client",
    "riskTier": "hitl",
    "adapter": { "kind": "dom", "pathPrefixes": ["/"] },
    "resultSchema": {
      "type": "object",
      "properties": {
        "reads": { "type": "object" },
        "completedSteps": { "type": "number" },
        "url": { "type": "string" }
      }
    }
  },
  {
    "id": "xianyu-shipping.execute-intent",
    "featureIds": ["xianyu-orders"],
    "description": "执行可信服务端连接器登记的一次性订单发货意图。参数只能是 opaque intentId；订单、商品和固定单击步骤均从 toolgate 内存意图取得。执行后必须由新快照精确确认平台状态已变为“已发货”，否则转人工且不重试。",
    "params": {
      "type": "object",
      "additionalProperties": false,
      "required": ["intentId"],
      "properties": {
        "intentId": { "type": "string", "minLength": 1, "description": "可信连接器返回的一次性发货意图标识" }
      }
    },
    "execution": "client",
    "riskTier": "hitl",
    "hitlMode": "every-call",
    "authorization": {
      "kind": "bounded-fulfillment",
      "workflow": "shipment",
      "intentIdParam": "intentId",
      "preparation": {
        "description": "在闲鱼待发货订单详情页，依据当前 URL、页面快照和服务端商品映射准备一次受控发货。无业务参数；成功只返回 opaque intentId，随后只能传给 xianyu-shipping.execute-intent。订单、商品、状态或“发货”按钮证据不唯一时会拒绝。",
        "routes": ["/seller-trade/order-manage/order-detail"],
        "params": {
          "orderId": { "source": "hash-query", "name": "orderId", "pattern": "^[A-Za-z0-9_-]{1,128}$" },
          "productId": {
            "source": "element-href",
            "urlOrigin": "https://www.goofish.com",
            "urlPath": "/item",
            "queryParam": "id",
            "pattern": "^[A-Za-z0-9_-]{1,128}$"
          }
        },
        "productParam": "productId",
        "elements": {
          "actionRef": { "role": "button", "label": "发货", "requireEnabled": true }
        },
        "paramEvidence": {
          "param": "orderId",
          "roles": ["cell", "td", "dt", "dd", "span"],
          "labelPrefixes": ["订单编号"]
        },
        "evidence": { "rule": "order-shipment-status", "before": "待发货", "after": "已发货" },
        "intentTtlMs": 45000
      }
    },
    "adapter": {
      "kind": "dom",
      "pathPrefixes": ["/"],
      "snapshotEvidence": [
        {
          "id": "order-shipment-status",
          "itemSelector": ".ant-steps-item",
          "statusSelector": ".ant-steps-item-title",
          "statuses": ["待发货", "已发货"]
        }
      ]
    },
    "resultSchema": {
      "type": "object",
      "required": ["reads", "completedSteps"],
      "properties": {
        "reads": { "type": "object" },
        "completedSteps": { "type": "integer", "const": 1 },
        "url": { "type": "string" }
      }
    }
  }
]
